headline_main,pub_date,lead_paragraph,Compound_Score
Celebrity Crypto-Hawkers Should Get a Close Look,2022-12-17T14:00:05+0000,,0.0
"Even After FTX, S.E.C. Chair Sees No Need for New Crypto Laws",2022-12-22T20:03:56+0000,,-0.296
"In FTX Collapse, Binance Sees a Chance to Become the New Face of Crypto",2022-12-13T00:27:36+0000,,-0.296
Two Executives in Sam Bankman-Fried’s Crypto Empire Plead Guilty to Fraud,2022-12-22T01:58:42+0000,,-0.765
Inside the Frantic Texts Exchanged by Crypto Executives as FTX Collapsed,2022-12-09T06:04:36+0000,,-0.6124
The Crypto Industry Struggles for a Way Forward,2022-12-05T10:00:19+0000,,-0.3612
"Crypto Crashes, but the Awards Go On",2022-12-02T01:38:59+0000,,0.6124
Ordinary Investors Who Jumped Into Crypto Are Saying: Now What?,2022-12-05T18:33:36+0000,,0.0
BlackRock C.E.O. Discusses FTX Crypto Exchange Collapse,2022-11-30T17:52:11+0000,,-0.4939
How the Collapse of Sam Bankman-Fried’s Crypto Empire Has Disrupted A.I.,2022-12-01T10:00:43+0000,,-0.4939
Idle Crypto Is the Devil’s Workshop,2022-11-27T14:30:59+0000,,0.0
Crypto Lender BlockFi Files for Bankruptcy as FTX Fallout Spreads,2022-11-28T15:23:14+0000,,0.0
Sam Bankman-Fried’s Power Was Contingent on Belief,2022-12-28T10:00:04+0000,,0.0
U.S. Crypto Exchange Kraken Settles With Treasury Dept.,2022-11-28T19:01:22+0000,,0.2023
The 2022 Good Tech Awards,2022-12-29T10:00:19+0000,,0.7096
"In the Bahamas, a Lingering Sympathy for Sam Bankman-Fried",2022-12-26T18:45:28+0000,,0.3612
How Did Sam Bankman-Fried Make His $250 Million Bail?,2022-12-23T19:29:18+0000,,0.0
Alameda Executive Says She Is ‘Truly Sorry’ for Her Role in FTX Collapse,2022-12-23T23:14:34+0000,,-0.4939
Sam Bankman-Fried Released on $250 Million Bond With Restrictions,2022-12-22T18:52:29+0000,,0.0
Sam Bankman-Fried Is Set for Extradition to U.S.,2022-12-21T17:07:25+0000,,0.0
Sam Bankman-Fried Said to Be in Talks With Prosecutors Over Bail Deal,2022-12-21T02:07:08+0000,,0.0
FTX Founder Leaves Court in Handcuffs,2022-12-19T21:13:15+0000,,0.0
Sam Bankman-Fried Said to Agree to Extradition After Chaotic Hearing,2022-12-19T18:36:04+0000,,-0.1779
Sam Bankman-Fried Is Expected to Agree to Extradition to the U.S.,2022-12-18T00:49:46+0000,,0.3612
"Restaurateur, Political Donor, Tipster: The Many Roles of FTX’s Ryan Salame",2022-12-17T08:00:10+0000,,0.0
U.S. Scrutinizes Political Donations by Sam Bankman-Fried and Allies,2022-12-17T20:16:02+0000,,0.0
A Traditional Exchange? FTX Was Anything But.,2022-12-16T08:00:09+0000,,0.0
She Was a Little-Known Crypto Trader. Then FTX Collapsed.,2022-11-23T19:23:39+0000,,-0.2732
Prosecutor Announces Charges Against FTX Founder,2022-12-14T04:35:52+0000,,-0.2732
FTX Chief: Company Appeared to Use ‘Old-Fashioned Embezzlement’,2022-12-13T19:55:48+0000,,0.0
"FTX Used ‘Old-Fashioned Embezzlement,’ New Chief Says",2022-12-13T20:23:28+0000,,0.0
"Prosecutors Say FTX Was Engaged in a ‘Massive, Yearslong Fraud’",2022-12-13T16:02:43+0000,,0.4019
House Committee Vows to Find Answers Behind FTX Collapse,2022-12-13T16:54:08+0000,,-0.4939
Prosecutor in Bankman-Fried Case Made a Career of White-Collar Cases,2022-12-13T22:02:56+0000,,0.0
"Who is John J. Ray III, FTX’s new chief executive?",2022-12-13T15:13:07+0000,,0.0
FTX’s Sam Bankman-Fried Is Arrested in the Bahamas,2022-12-12T23:51:25+0000,,-0.4767
The Parents in the Middle of FTX’s Collapse,2022-12-13T01:01:58+0000,,-0.4939
Inside a Crypto Nemesis’ Campaign to Rein In the Industry,2022-11-21T08:00:13+0000,,0.0
"Genesis, the Troubled Crypto Lender, Hires a Restructuring Adviser",2022-11-22T19:33:09+0000,,-0.4588
New York Enacts 2-Year Ban on Some Crypto-Mining Operations,2022-11-23T00:21:25+0000,,-0.5574
Sam Bankman-Fried Agrees to Testify Before House Committee,2022-12-09T13:49:45+0000,,0.2023
Why the Crypto Collapse Matters,2022-11-17T11:36:30+0000,,-0.4767
FTX Founder Sam Bankman-Fried Is Said to Face Market Manipulation Inquiry,2022-12-08T00:24:19+0000,,-0.296
Crypto Firm FTX’s Ownership of a U.S. Bank Raises Questions,2022-11-23T20:03:19+0000,,0.0
The Man Who Was Supposed to Save Crypto,2022-11-18T11:00:10+0000,,0.4939
Is This the End Game for Crypto?,2022-11-18T00:00:08+0000,,0.0
Inside Sam Bankman-Fried’s Quest to Win Friends and Influence People,2022-11-22T19:32:26+0000,,0.7845
"Blockchains, What Are They Good For?",2022-12-02T00:00:09+0000,,0.4404
Sam Bankman-Fried Blames ‘Huge Management Failures’ for FTX Collapse,2022-11-30T23:44:45+0000,,-0.7096
Transcript of Sam Bankman-Fried’s Interview at the DealBook Summit,2022-12-01T06:30:33+0000,,0.0
Yellen Urges More Regulation of Cryptocurrencies after FTX Collapse,2022-11-30T15:32:19+0000,,-0.4939
‘No Cooperation’: How Sam Bankman-Fried Tried to Cling to FTX,2022-11-29T10:00:21+0000,,0.0
Here’s the Latest on the FTX Collapse,2022-11-28T20:09:43+0000,,-0.4939
The Crypto Ponzi Scheme Avenger,2022-11-11T10:00:21+0000,,0.0
Embattled Crypto Exchange FTX Files for Bankruptcy,2022-11-11T14:33:36+0000,,0.0
How FTX’s Sister Firm Brought the Crypto Exchange Down,2022-11-18T10:00:36+0000,,0.0
Is This Crypto’s Lehman Moment?,2022-11-09T19:58:27+0000,,0.0
Collapsed Crypto Exchange FTX Could Owe More Than 1 Million Creditors,2022-11-15T15:13:13+0000,,-0.2732
Why Did We Put So Much Faith in the Crypto Whiz Kid?,2022-11-15T10:00:06+0000,,0.4728
How Sam Bankman-Fried’s Crypto Empire Collapsed,2022-11-14T22:06:24+0000,,-0.2732
Crypto World Is Rocked as World’s Largest Exchange Rescues Rival,2022-11-08T16:42:03+0000,,0.3182
FTX Assets Still Missing as Firm Begins Bankruptcy Process,2022-11-22T17:42:19+0000,,-0.128
What Stage of Capitalism Is Sam Bankman-Fried?,2022-11-21T20:00:06+0000,,0.0
FTX Investigating Possible Hack Hours After Bankruptcy Filing,2022-11-12T14:31:05+0000,,0.0
What Is Next for the FTX Fallout?,2022-11-19T13:00:03+0000,,0.0
FTX Crypto Exchange Boss Says He Is Trying to Raise More Money,2022-11-10T15:52:14+0000,,0.0
"This Week, Billionaires Made a Strong Case for Abolishing Themselves",2022-11-19T14:23:57+0000,,0.5106
Binance Pulls Out of Deal to Acquire Rival Crypto Exchange FTX,2022-11-09T19:44:09+0000,,0.0
What Happens When Crypto Meets Ted Lasso,2022-11-06T10:00:24+0000,,0.0
New Chief Calls FTX’s Corporate Control a ‘Complete Failure’,2022-11-17T13:38:17+0000,,0.0
They Thought They Were Invisible. They Were Wrong.,2022-11-16T10:00:24+0000,,-0.4767
FTX’s In-House Performance Coach Is Just as Surprised as You Are,2022-11-15T22:18:54+0000,,0.2263
FTX’s Collapse Casts a Pall on a Philanthropy Movement,2022-11-14T00:00:21+0000,,-0.4939
FTX’s founder was called a modern-day J.P. Morgan. The analogy still works.,2022-11-12T13:00:03+0000,,0.0
"Investors Who Put $2 Billion Into FTX Face Scrutiny, Too",2022-11-11T19:39:17+0000,,0.0
FTX Spent Big on Sports Sponsorships. What Happens Now?,2022-11-11T00:29:07+0000,,0.0
Why Did FTX Collapse? Here’s What to Know.,2022-11-10T21:58:17+0000,,-0.4939
"For Many, Elon Musk’s Buying Twitter Is a Moment of Celebration",2022-10-28T17:00:14+0000,,0.0
U.S. Fines Crypto Exchange a Record $24 Million for Breaking Sanctions,2022-10-11T15:01:06+0000,,0.0
"Crypto Needs More Rules and Better Enforcement, Regulators Warn",2022-10-03T20:34:05+0000,,0.4144
"Binance Blockchain Hit by $570 Million Hack, Exposing Crypto Vulnerabilities",2022-10-07T16:40:16+0000,,-0.4019
The Crypto World Is on Edge After a String of Hacks,2022-09-28T09:00:37+0000,,0.0
Ethereum’s Founder on What Crypto Can — and Can’t — Do,2022-09-30T09:00:09+0000,,0.0
"C.E.O. of Celsius, the Crypto Bank, Resigns",2022-09-27T17:33:11+0000,,-0.3182
"On Portugal’s ‘Bitcoin Beach,’ Crypto Optimism Still Reigns",2022-09-28T07:00:14+0000,,0.5423
Kim Kardashian to Pay $1.26 Million to Settle S.E.C. Charges Over Crypto Promotion,2022-10-03T12:44:51+0000,,-0.3612
Interpol Issues ‘Red Notice’ for South Korean Crypto Founder Do Kwon,2022-09-26T11:04:03+0000,,0.0
Can ‘the Merge’ Save Crypto?,2022-09-15T13:00:14+0000,,0.4939
Crypto’s Long-Awaited ‘Merge’ Reaches the Finish Line,2022-09-15T07:09:46+0000,,0.0516
Celsius Network Plots a Comeback After a Crypto Crash,2022-09-13T16:29:28+0000,,-0.4019
Investors Sue Treasury Department for Blacklisting Crypto Platform,2022-09-08T13:36:15+0000,,0.2023
"C.E.O. of Kraken, the Cryptocurrency Exchange, Steps Down",2022-09-21T19:58:12+0000,,0.0
The Crypto World Can’t Wait for ‘the Merge’,2022-08-26T09:00:22+0000,,0.0
S.E.C. Chair Doubles Down on the Need to Regulate Cryptocurrencies,2022-09-09T14:28:45+0000,,0.0
Dissecting the Royal Family’s Wealth,2022-09-09T12:28:52+0000,,0.4939
"Crypto Is Tumbling, but in Argentina It’s Still a Safer Bet",2022-08-20T16:26:14+0000,,0.5719
They Lost Crypto in the Crash. They’re Trying to Get It Back.,2022-08-18T09:00:20+0000,,-0.6124
Watch Brands Keep the Crypto Faith,2022-08-10T09:06:03+0000,,0.4215
Treasury Dept. blacklists crypto platform used in money laundering.,2022-08-08T18:32:38+0000,,0.2023
What Is ‘the Merge’?,2022-08-26T09:00:17+0000,,0.0
The Hot New Market in Crypto? Trading FTX’s Carcass.,2023-12-20T10:03:17+0000,,0.0
The Power Vacuum at the Top of the Crypto Industry,2023-12-11T10:01:50+0000,,0.2023
Who Would Give This Guy Millions to Build His Own Utopia?,2023-12-12T17:13:10+0000,,0.0
Binance Founder Ordered to Remain in U.S. Before Sentencing,2023-12-08T05:14:53+0000,,-0.1531
Bitcoin Soars on Hopes of Investment Fund Approval,2023-12-05T14:23:58+0000,,0.7096
"Cryptocurrency Prices Surge, Driven by a Potential Bitcoin Fund",2023-11-16T15:12:41+0000,,0.0
U.S. Case Details Binance’s Knowledge About Criminal Users,2023-11-22T19:39:31+0000,,-0.5267
Justice Department Announces Binance’s Guilty Plea,2023-11-22T01:21:57+0000,,0.1531
Binance Founder Pleads Guilty to Violating Money Laundering Rules,2023-11-21T18:28:37+0000,,-0.743
Michael Lewis Tells His Own Story of Sam Bankman-Fried,2023-11-17T14:24:39+0000,,0.0
"For an N.B.A. Star, a Dream House Became a Nightmare",2023-11-15T21:50:47+0000,,0.25
Sam Bankman-Fried’s Wild Rise and Abrupt Crash,2023-11-03T00:21:01+0000,,-0.4019
"Sam Bankman-Fried Was a Grown Up Criminal, Not an Impulsive Man-Child",2023-11-03T07:00:14+0000,,-0.5267
Sam Bankman-Fried Is Found Guilty of 7 Counts of Fraud and Conspiracy,2023-11-02T23:58:21+0000,,-0.875
Reading List: Scams and Scammers,2023-11-08T17:59:02+0000,,-0.5859
Sam Bankman-Fried and the People Who Gave Up Their Money for Nothing,2023-11-08T10:02:33+0000,,0.0
Is Crypto Financing Terrorism?,2023-10-28T12:00:02+0000,,-0.6808
"Guilty on All Counts, Bankman-Fried Completes a Fall From Grace",2023-11-03T12:11:32+0000,,0.0
Silicon Valley Shrugs Off Sam Bankman-Fried’s Trial,2023-11-03T00:23:30+0000,,0.0
Jury Begins Deliberations for a Verdict in Sam Bankman-Fried’s Trial,2023-11-02T19:16:13+0000,,0.1531
Sam Bankman-Fried’s Trial Nears Finish as Closing Arguments Are Made,2023-11-01T17:19:25+0000,,-0.4019
"Sam Bankman-Fried Denies Knowing FTX Money Was Missing, as He Concludes Testimony",2023-10-31T17:18:35+0000,,-0.6124
Bankman-Fried’s Risky Defense Strategy Faces Another Big Test,2023-10-31T11:37:44+0000,,-0.0772
Crypto Influencers and ‘Degenerates’ Flock to Sam Bankman-Fried’s Trial,2023-10-20T09:03:43+0000,,0.0
Prosecutors Turn Sam Bankman-Fried’s Own Words Against Him,2023-10-30T18:11:37+0000,,0.0
New York Attorney General Sues Crypto Firms in $1 Billion Fraud Case,2023-10-19T11:00:44+0000,,-0.5859
Sam Bankman-Fried Testifies That He Made ‘Larger Mistakes’ at FTX,2023-10-27T17:44:32+0000,,0.0
The Shearing of Sam Bankman-Fried,2023-10-27T17:33:34+0000,,0.0
Sam Bankman-Fried’s Testimony Is Delayed at Fraud Trial,2023-10-26T15:16:38+0000,,-0.6908
Close Confidants of Sam Bankman-Fried Have Testified at His Trial,2023-10-26T15:21:07+0000,,0.0
The Challenges Facing Sam Bankman-Fried’s Lawyers,2023-10-25T16:46:37+0000,,0.0772
Sam Bankman-Fried Set to Testify at His Fraud Trial,2023-10-25T14:40:43+0000,,-0.5859
‘Oof’: Sam Bankman-Fried’s Trial Reveals Inside Details of How FTX Died,2023-10-20T09:03:32+0000,,-0.5574
Read the transcript of text between FTX executives,2023-10-19T22:07:58+0000,,0.0
Read the transcript of FTX executives’ text exchanges,2023-10-19T22:07:50+0000,,0.0
Read the exchange among FTX and Alameda executives,2023-10-19T22:10:32+0000,,0.0
Top FTX Executive Says Sam Bankman-Fried Used Customer Money for ‘Excess’ Spending,2023-10-16T17:27:52+0000,,0.2023
Crypto’s Trial of the Century Is Set to Begin,2023-10-02T12:06:39+0000,,0.0
"Crypto Goes on Trial, as Sam Bankman-Fried Faces His Reckoning",2023-10-02T09:00:46+0000,,0.0
"Across U.S., Chinese Bitcoin Mines Draw National Security Scrutiny",2023-10-13T09:02:11+0000,,0.34
Star Witness Caroline Ellison Says Sam Bankman-Fried Made ‘Terrible Mistakes’,2023-10-12T20:51:27+0000,,0.0
Sam Bankman-Fried’s Closest Friends Become His Foes in Courtroom Clash,2023-10-12T09:02:06+0000,,0.0258
Caroline Ellison Says She and Sam Bankman-Fried Lied for Years,2023-10-11T17:26:59+0000,,-0.3818
"Caroline Ellison, Adviser to Sam Bankman-Fried, Says He ‘Directed’ Her to Commit Crimes",2023-10-10T17:27:19+0000,,0.296
The Places That Sam Bankman-Fried Left Behind,2023-10-10T09:02:41+0000,,0.0
‘Don’t Do That Again’: Sam Bankman-Fried’s Lawyers Under Fire From Judge,2023-10-10T09:02:56+0000,,-0.34
A Founder of the Crypto Hedge Fund Three Arrows Capital Is Arrested,2023-09-29T17:53:24+0000,,-0.4767
Who’s Rooting Hardest for a Sam Bankman-Fried Conviction? The Crypto Industry.,2023-10-02T09:00:57+0000,,0.0
FTX Chief Once Met With Powell. Now D.C. Crypto Lobbyists Are Struggling.,2023-09-27T09:02:38+0000,,-0.4215
"The Big Number: 1,300",2023-10-06T16:42:55+0000,,0.0772
"Gary Wang, an FTX Founder, Says Sam Bankman-Fried Steered Misuse of Funds",2023-10-06T18:18:04+0000,,0.0
Michael Lewis Doesn’t Do Villains,2023-10-06T15:18:54+0000,,-0.6597
New Details About FTX Emerge as Bankman-Fried’s Trial Begins,2023-10-05T12:07:09+0000,,0.0
‘Lied to the World’ or Acted in ‘Good Faith’: Sam Bankman-Fried’s Trial Opens,2023-10-04T19:18:46+0000,,0.0
Sam Bankman-Fried Goes on Trial,2023-10-03T10:00:02+0000,,0.0
What to Know About Sam Bankman-Fried’s Fraud Trial,2023-10-03T13:10:09+0000,,-0.5859
"Today’s Top News: Gaetz Moves to Oust McCarthy, and More",2023-10-03T09:45:10+0000,,0.2023
Even Michael Lewis Can’t Make a Hero Out of Sam Bankman-Fried,2023-10-02T23:41:14+0000,,0.5574
Takeaways From a New Book on Sam Bankman-Fried,2023-10-03T00:08:53+0000,,0.0
The Lawyers Sam Bankman-Fried Once Trusted Are Drawing Criticism,2023-09-21T09:00:59+0000,,0.0516
A $700 Million Bonanza for the Winners of Crypto’s Collapse: Lawyers,2023-09-05T09:01:04+0000,,-0.0258
Sam Bankman-Fried’s Parents Sued by FTX,2023-09-19T08:14:41+0000,,0.0
‘One of the Most Hated People in the World’: Sam Bankman-Fried’s 250 Pages of Justifications,2023-09-14T21:09:16+0000,,-0.6697
Crypto Is Dead? Or Is That Just ‘Fud’?,2023-08-25T09:03:27+0000,,-0.6868
Fourth Top FTX Executive Pleads Guilty Ahead of Sam Bankman-Fried Trial,2023-09-07T14:56:09+0000,,-0.25
"Bread, Water and Peanut Butter: Sam Bankman-Fried’s Life in Jail",2023-09-05T21:31:11+0000,,0.0
Letter to a Young Crypto Enthusiast (or the Merely Curious),2023-08-13T09:00:41+0000,,0.3612
The Paranoid Style in American Plutocrats,2023-08-28T23:00:10+0000,,-0.25
Crypto’s Next Craze? Orbs That Scan Your Eyeballs.,2023-08-07T15:05:19+0000,,-0.1531
Prosecutors Detail Evidence Against Sam Bankman-Fried,2023-08-15T00:35:13+0000,,0.0
Investor Charged With Kidnapping ‘Crypto King’,2023-07-20T13:02:04+0000,,-0.2023
Sam Bankman-Fried Sent to Jail After Judge Revokes Bail,2023-08-11T19:31:19+0000,,0.0
Founder of Bankrupt Crypto Firm Celsius Is Arrested on Fraud Charges,2023-07-13T15:10:01+0000,,-0.9118
Crypto Industry Secures Early Victory in Legal Battle With Regulators,2023-07-13T19:28:19+0000,,0.0516
F.B.I. Searched the Home of Crypto Exchange Founder,2023-07-06T22:14:55+0000,,0.0
"Inside the Private Writings of Caroline Ellison, Star Witness in the FTX Case",2023-07-20T09:00:34+0000,,0.0
How Tom Brady’s Crypto Ambitions Collided With Reality,2023-07-06T09:00:56+0000,,0.0
How a Crypto Fugitive Upended the Politics of a Troubled Balkan Nation,2023-06-24T15:38:27+0000,,-0.4588
Their Crypto Company Collapsed. They Went to Bali.,2023-06-09T15:06:47+0000,,-0.2732
Prosecutors Drop Campaign Finance Charge Against Sam Bankman-Fried,2023-07-27T13:07:50+0000,,-0.2732
Crypto Firms Start Looking Abroad as U.S. Cracks Down,2023-06-07T09:00:26+0000,,0.0
"Crypto Meltdown, What Crypto Meltdown?",2023-01-17T08:00:13+0000,,0.0
Coinbase Accused of Breaking Market Rules as Crypto Crackdown Widens,2023-06-06T12:51:24+0000,,-0.296
Crypto Wants Its Shine Back,2023-03-20T09:00:15+0000,,0.0
Crypto ads are so last year.,2023-02-12T23:46:43+0000,,0.0
2 Charged in Plot to Launder Billions in Cryptocurrency Reach Plea Deal,2023-07-21T18:08:50+0000,,-0.1779
He Went After Crypto Companies. Then Someone Came After Him.,2023-06-18T09:00:36+0000,,0.0
The Crypto Detectives Are Cleaning Up,2023-04-22T09:00:28+0000,,0.0
"Genesis, a Crypto Lending Firm, Files for Bankruptcy",2023-01-20T06:45:14+0000,,0.0
Binance Faces Mounting Pressure as U.S. Crypto Crackdown Intensifies,2023-04-26T07:00:08+0000,,-0.296
Government Cracks Down on Crypto Industry With Flurry of Actions,2023-02-18T08:00:09+0000,,0.0
The Crypto Collapse and the End of the Magical Thinking That Infected Capitalism,2023-01-16T10:00:16+0000,,-0.7506
The S.E.C.’s Crypto Crackdown Intensifies,2023-01-13T13:07:14+0000,,0.0
Authorities Step Up Their Crypto Crackdown,2023-02-17T12:36:57+0000,,0.0
"Binance Is Hiding U.S. Crypto Trading Activity, Regulator Says",2023-03-27T16:52:23+0000,,-0.296
"FTX Founder Gamed Markets, Crypto Rivals Say",2023-01-18T18:33:21+0000,,0.0
S.E.C. Accuses Binance of Mishandling Funds and Lying to Regulators,2023-06-05T15:14:38+0000,,-0.7003
Crypto Crackdown: Coinbase and Binance Lawsuits Shake Markets,2023-06-07T09:01:22+0000,,-0.3182
Pressure Grows on Another Crypto Giant,2023-03-06T12:44:16+0000,,-0.296
Which Celebrities Are Facing Backlash for Crypto Promotion?,2023-03-23T23:30:08+0000,,0.0
Trump Picks Paul Atkins to Run the S.E.C.,2024-12-04T17:59:26+0000,,0.0
Trump Media May Be Mulling a Crypto Payment Service,2024-11-21T18:58:42+0000,,0.0
The Cryptocurrency You May Not Even Know You Own,2024-12-06T10:02:42+0000,,0.0
"Bitcoin Hits a Milestone: $100,000",2024-12-05T02:55:01+0000,,0.0
The NFT Is Dead. Long Live the NFT?,2024-12-05T10:02:24+0000,,-0.6486
Trump Organization Plans an Ethics Policy Without Banning Foreign Deals,2024-12-05T10:06:03+0000,,0.0
Will Trump Be the President of Vice?,2024-12-04T10:02:33+0000,,0.0
How Crypto Enthusiasts Hijacked a Dog Mayor Competition,2024-11-13T16:04:31+0000,,0.34
Crypto Industry Lobbies Trump and His Allies to Capitalize on Election Wins,2024-11-13T10:02:42+0000,,0.5719
Peeling the $6.2 Million Banana: An Auction Explainer,2024-11-21T21:32:20+0000,,0.0
"Gary Wang, a Top FTX Executive, Is Given No Prison Time",2024-11-20T15:44:49+0000,,-0.5719
The Crypto Industry Spent Over $130 Million on the Election. It Paid Off.,2024-11-06T16:53:10+0000,,0.0
Bitcoin Surges to Record as Crypto Investors Cheer Trump Win,2024-11-06T03:52:36+0000,,0.7964
Mr. Musk Goes to Washington — With a $2 Trillion Agenda,2024-11-13T12:47:17+0000,,0.0
Bitcoin and Stocks Set Records as Bullish Bets Continue,2024-11-11T15:03:57+0000,,0.0
A Banker Is Scouting Trump’s Nominees. Some Will Oversee His Interests.,2024-11-09T13:33:46+0000,,0.25
What a Trump Victory Means for Tech,2024-11-06T17:08:05+0000,,0.0
"Cryptocurrency Markets, Promoted by Trump, Brace for Election Volatility",2024-11-05T11:34:45+0000,,0.4215
Why Harris and Trump Are Pandering to Crypto Plutocrats,2024-10-23T19:05:04+0000,,0.0
The Crypto Website Where the Election Odds Swing in Trump’s Favor,2024-10-25T09:06:27+0000,,0.4019
How Two Allies Wrestled Over a Crypto Giant and a Prisoner,2024-10-24T13:37:58+0000,,-0.5423
Kraken Lays Off 15% of Workers and Names New Co-Chief Executive,2024-10-30T20:18:30+0000,,0.0
"Nishad Singh, a Top FTX Executive, Is Given No Prison Time After Cooperation",2024-10-30T20:23:29+0000,,-0.5719
How FTX’s Young Executives Shattered Their Parents,2024-10-30T09:02:24+0000,,-0.4767
Read a letter from Sam Bankman-Fried’s father.,2024-10-30T11:20:17+0000,,0.0
Here is the letter from Caroline Ellison’s parents to Judge Kaplan.,2024-10-30T11:21:21+0000,,0.0
Here is the letter from Sam Bankman-Fried’s parents to Judge Kaplan.,2024-10-30T11:15:26+0000,,0.0
How Donald Trump Is Making Big Promises to Big Business,2024-10-26T09:04:15+0000,,0.3818
Charges Dropped in Case Against Binance Employee Held in Nigeria,2024-10-23T12:36:39+0000,,-0.2732
The Endless Downfall of a Crypto Power Couple,2024-10-10T09:00:28+0000,,0.0
The ‘Crypto Punks’ Behind Trump’s Murky New Business Venture,2024-10-07T09:01:40+0000,,0.0
Is the Trump Trade Back?,2024-10-17T12:11:36+0000,,0.0
Why Trump Wants to Make America the ‘Crypto Capital of the Planet’,2024-10-02T09:03:36+0000,,0.0
A New Bitcoin Documentary Reopens the Search for Satoshi Nakamoto,2024-10-09T01:00:07+0000,,0.0
The Tech Bro Style in American Politics,2024-09-26T23:00:07+0000,,0.0
Why Do People Like Elon Musk Love Donald Trump? It’s Not Just About Money.,2024-09-25T09:04:35+0000,,0.7717
"Caroline Ellison, Star Witness at FTX Trial, Is Sentenced to 2 Years in Prison",2024-09-24T20:17:43+0000,,-0.5267
Donald Trump Prepares to Unveil a Cryptocurrency Business,2024-09-13T17:45:35+0000,,0.0
"2 Stole $230 Million in Cryptocurrency and Went on a Spending Spree, U.S. Says",2024-09-20T20:08:21+0000,,0.0
"Caroline Ellison, Star Witness in FTX Case, Should Receive Lenient Sentence, Prosecutors Signal",2024-09-17T20:17:57+0000,,0.34
Trump Rolls Out His New Cryptocurrency Business,2024-09-17T01:43:50+0000,,0.0
Naked Emperors and Crypto Campaign Cash,2024-08-29T23:00:08+0000,,0.0
Sam Bankman-Fried Files Appeal to Overturn Fraud Conviction,2024-09-13T19:09:36+0000,,-0.5859
U.S. Presses Nigeria to Release Imprisoned Binance Employee,2024-09-12T16:45:58+0000,,-0.4588
Telegram’s Loudest Defender: The Global Crypto Industry,2024-08-27T15:22:14+0000,,0.1027
Crypto Lobbyist Charged With Breaking Campaign Finance Rules,2024-08-22T21:28:57+0000,,-0.2023
The Unraveling of a Crypto Dream,2024-08-13T04:01:30+0000,,0.25
Don’t Get Fooled Again by Crypto,2024-08-09T09:03:25+0000,,-0.3818
How 2024 Became a Crypto Election,2024-08-01T23:00:06+0000,,0.0
We All Live in Vegas Now,2024-08-21T19:05:04+0000,,0.0
He Was an Online Drug Lord. Now He’s a Crypto Entrepreneur.,2024-07-24T09:01:54+0000,,0.0
"From Tips to TikTok, Trump Swaps Policies With Aim to Please Voters",2024-08-08T14:35:48+0000,,0.3182
"Bitcoin and other cryptocurrencies plunge, mirroring global markets.",2024-08-05T14:50:55+0000,,0.0
A Digital Coin Based on Baby Trump? Yup.,2024-07-27T07:00:28+0000,,0.0
A Crypto Bull’s Big Tax Settlement,2024-06-03T11:31:14+0000,,0.0
How Crypto Money Is Poised to Influence the Election,2024-06-17T16:00:18+0000,,0.25
The Night That Sotheby’s Was Crypto-Punked,2024-05-18T09:00:55+0000,,0.0
The Crypto Comeback,2024-05-21T10:00:10+0000,,0.0
"When Sports Games Feel Like Casinos, Players Rarely Win",2024-07-22T09:00:23+0000,,-0.1461
How a Crypto Compliance Officer Ended Up in a Nigerian Prison,2024-04-18T16:10:35+0000,,-0.5106
Crypto Funds Have Arrived. But Who Needs Them?,2024-01-19T14:00:11+0000,,0.0
Crypto Super PAC to Target Races in Ohio and Montana That Could Swing the Senate,2024-03-08T15:47:32+0000,,0.5994
Manhattan Woman Convicted of Using Crypto to Fund Terror Groups in Syria,2024-02-01T22:44:17+0000,,-0.5267
Is Crypto Back? What to Know About Bitcoin’s Surge.,2024-03-05T19:29:31+0000,,0.0
This Man Did Not Invent Bitcoin,2024-05-21T09:02:05+0000,,0.0
Bloomberg and Crypto Billionaire Among Donors to Adams’s Legal Defense,2024-01-16T22:47:56+0000,,0.25
"Mediapocalypse Now, a16z’s Chris Dixon Defends Crypto, and HatGPT",2024-01-26T10:01:44+0000,,0.0
Trump Names Top Silicon Valley Conservative to Oversee Crypto and A.I.,2024-12-06T02:36:14+0000,,0.2023
"Trump, Appealing to Bitcoin Fans, Vows U.S. Will Be ‘Crypto Capital of the Planet’",2024-07-28T02:22:34+0000,,0.0
"Crypto PAC Jumps Into Senate Race, Opposing Katie Porter in California",2024-02-13T10:03:07+0000,,0.0
What Meltdown? Crypto Comes Roaring Back in the Philippines.,2024-03-18T04:00:22+0000,,0.0
Crypto Congress + HBD ChatGPT + What Social Media Platform Should I Be On?,2024-11-15T12:00:06+0000,,0.0
Is Cryptocurrency Like Stocks and Bonds? Courts Move Closer to an Answer.,2024-01-26T10:01:13+0000,,0.3612
Quote of the Day: Crypto Entrepreneur Pays $6.2 Million for Banana-as-Art,2024-11-22T04:59:00+0000,,0.0
Sam Bankman-Fried Sentenced to 25 Years in Prison,2024-03-28T15:47:29+0000,,-0.5267
"He’s Lost His Marriage, His Followers and His Lamborghini",2024-02-02T16:23:30+0000,,-0.3182
"Regulators Approve New Type of Bitcoin Fund, in Boon for Crypto Industry",2024-01-10T21:34:28+0000,,0.0
Who’s Laughing Now? Banana-as-Art Sells for $6.2 Million at Sotheby’s,2024-11-21T00:54:25+0000,,0.4939
High Food Prices: The Causes and the Politics,2024-08-19T16:25:44+0000,,0.0
Top FTX Executive Sentenced to 7½ Years in Prison,2024-05-28T16:07:43+0000,,-0.3818
U.S. Approves Investment Product Tied to Popular Cryptocurrency Ether,2024-05-24T01:40:22+0000,,0.6705
"Kabosu, Shiba Inu Who Helped Define the Doge Meme, Dies at 18",2024-05-24T11:27:54+0000,,0.0
Sam Bankman-Fried Transferred From Brooklyn Jail,2024-05-22T16:49:14+0000,,0.0
Biden Bans Chinese Bitcoin Mine Near U.S. Nuclear Missile Base,2024-05-14T01:23:38+0000,,0.0
The Big Number: $8 Billion,2024-05-10T15:53:23+0000,,0.0772
FTX Customers Poised to Recover All Funds Lost in Collapse,2024-05-08T05:31:36+0000,,-0.5423
